,Unnamed: 0,Title,Company,Links,Ratings,Address,Salary,Job description,full-description
50,50,Remote Software Engineer (experienced),Gearset,https://uk.indeed.com/rc/clk?jk=982c15cf1f3018b6&fccid=5e59d50f728cbb64&vjs=3,5.0,Remote,"£45,000 - £70,000 a year","Experience working in an agile development team, following software engineering best practices.
Can write code and solve complex problems.","At Gearset, we build a cutting-edge DevOps solution for the millions of developers building applications on Salesforce. In only three years Gearset has become the DevOps solution of choice for some of the world’s biggest companies, including IBM, McKesson, and even Salesforce themselves.

As a Software Engineer at Gearset you'll join a passionate and experienced cross-functional development team with a laser focus on quality - from infrastructure, to code, to user experience. The features you build will make thousands of businesses around the world more effective.

Who are we?

We're a team of smart, pragmatic people who enjoy giving our best every day to solve our users' problems. We recently received three awards from Best Companies in 2021, putting us in the top 10 best mid-sized companies to work for, the top three best technology companies in the UK, and top 5 best companies in the East of England.

We’re proud of what we’ve built and how we’ve built it. We work as a team, where attributes of trust, openness and honesty are key, as they allow us to have a feedback-driven culture that keeps us always improving. To learn more about what “ good” looks like to us, read about our engineering values here.
You'll be a good fit if you:
Can write code and solve complex problems. Generally, this means having: a bachelor's degree from a top university, or a few years experience working as a programmer in a software development team
Like to write well-structured, testable code, with a focus on simplicity and maintainability
Care about quality, not only of the code you write, but of the product you're building
Are comfortable with both frontend and backend development
Enjoy working with a collaborative team of varied disciplines, including developers, designers, marketers and salespeople
Have an enthusiasm for working directly with users to build and deliver the right features
Are a skilled developer, but more importantly, have an innate desire to learn and improve
Can work closely with your team members and make an active effort to collaborate effectively

Working at Gearset, you will:
Maintain and extend existing features, and collaborate with the rest of the development team to spec, design and build new features end-to-end
Learn from, and share your experience with, a great team - alumni of Microsoft, EA and Cambridge University to name a few
Become familiar with a pragmatically-chosen tech stack, including a mix of cutting-edge and proven technologies such as Docker, AWS, C#, and TeamCity
Work closely with users, delighting them with support, researching new features and soliciting feedback
Contribute opinions on a range of topics, from development practices to product strategy and roadmap
Nice to haves:
Familiarity with JavaScript and C#
Experience working on a hosted product
Experience working in an agile development team, following software engineering best practices
Previous experience working remotely
Benefits:
Salary is £45k - £70k, depending on experience
Bupa health care
Flexible working hours
Note that you must be based in the UK for this role."
51,51,Edinburgh Software Engineering Gradate Programme 2022-2023,Accenture,https://uk.indeed.com/rc/clk?jk=0d125ea0e82bef99&fccid=a4e4e2eaf26690c9&vjs=3,4.0,Edinburgh,"£25,700 a year","Salary: £25,700 plus £1,000 sign-on bonus.
As a key member of project teams, you’ll work side by side with our clients in a variety of s, understanding the…","Software Engineering Graduate Programme

Location: Edinburgh
Salary: £25,700 plus £1,000 sign-on bonus
Technology is changing the world faster than ever before – and when combined with human ingenuity, the potential is unlimited. We believe that positive change happens by bringing together different people with diverse experiences and perspectives. Join us and never stop learning new ways to build a better future.
We look for passionate, curious and solution-driven team players who are ready to ignite ideas and inspired to push boundaries. accenture.com/ukgraduates
About Accenture

Accenture is a global professional services company with leading capabilities in digital, cloud and security. Combining unmatched experience and specialized skills across more than 40 industries, we offer Strategy and Consulting, Interactive, Technology and Operations services — all powered by the world’s largest network of Advanced Technology and Intelligent Operations centers. Our 624,000 people deliver on the promise of technology and human ingenuity every day, serving clients in more than 120 countries. We embrace the power of change to create value and shared success for our clients, people, shareholders, partners and communities. Visit us at www.accenture.com.
Software Engineering Graduate Programme
On this programme, you can expect to be working directly with our clients to help deliver projects using some of the most advanced technologies on the market. You will help drive and deliver business transformation, develop industry-leading specialist skills, and help transform our clients around the world. This will include designing, building testing and deploying strategic solutions for our clients.
As a key member of project teams, you’ll work side by side with our clients in a variety of s, understanding the challenges and requirements, helping to formulate a plan of action and collaborating with local and global teams to deliver innovative solutions.
What you’ll learn
As an Associate in Software Engineering, we are looking for people with an interest in getting hands-on with technology. But we don’t expect you to know it all. Depending on the nature of the project we will train you in technologies such as Java/J2EE, C#, HTML5, CSS, JavaScript, jQuery, and Angular.js.
What’s in it for you
As well as the prospect of a great career centred around improving the way the world works and lives, you will get the opportunity to work with a vast array of highly-skilled people and continue to learn and grow your skills through our extensive training program.
You can look forward to a competitive starting salary and a generous holiday allowance. Other benefits include a pension scheme, personal laptop, an AMEX card, private healthcare, subsidised gym membership, season ticket loan and much more besides. For a comprehensive list of all our benefits, visit our website.

What we’re looking for
On the Software Engineering Graduate Programme, we’re looking for a passion to grow and develop, a desire for self-improvement, a curious mind, and a strong work ethic. You will bring a creative and innovative mindset to your work and clients while ensuring the highest quality work delivered on time.
For Software Engineering, IT skills are essential. You will need a degree in IT, computer science, or a technology-related subject. However, if you have a real passion and flair for technology, as well as an understanding of how it can be used, we will consider a maths, science, or engineering degree. We expect you to have a real interest in software engineering and end-to-end design and delivery, and you’ll know a thing or two about programming.
If you are successful, you will need to be available for start dates between October 2022 and July 2023.
Where you’ll work
You will need to live within commutable distance of your home office which will be Edinburgh. Due to the nature of our work, you may be delivering projects on client sites anywhere in the UK and sometimes outside of the UK. You will need to be prepared to travel and sometimes live away from home for long periods of time.
Places are filled on a first-come, first-served basis. So please apply early to avoid disappointment.
Deadline for applications is 31/12/2021. Accenture reserves the right to close the role prior to this date should suitable applicants be found.
Any offer of employment is subject to satisfactory BPSS and SC security clearance. This means that you must have 5 years’ continuous UK address history at the point of joining Accenture."
52,52,"Senior Backend Engineer, Platform",Monzo,https://uk.indeed.com/rc/clk?jk=34ef9936cd47d26e&fccid=73da13d58dc1080c&vjs=3,3.9,London Remote,"£70,000 - £116,000 a year",We're looking for engineers with experience working with Platforms who are software engineers at heart - you're as comfortable writing software to solve…,"At Monzo we're aiming to build the best current account in the world. We are always keen to hear from capable, creative engineers who want to help us accomplish that goal
We're currently looking for Senior Backend Engineers to join our Platform team.
We're looking for engineers with experience working with Platforms who are software engineers at heart - you're as comfortable writing software to solve problems as you are operating AWS or Kubernetes. If you're a software engineer who has some good cloud infrastructure experience already, or you're eager to get really familiar with systems, tooling and libraries, this could be the role for you.
As a team, we're responsible for designing, building, and operating the services we consume from AWS, along with the software we run on top like Kubernetes, Cassandra, Prometheus, and Kafka. We're also responsible for operating our two physical data centres, our network, and being on-call for the things we own and run.
To achieve this, we're organised into three squads within the Platform Group; Infrastructure Platform, Backend Platform and Stateful Platform. Each squad is responsible for solving a specific set of problems for our customers and our engineers. We're looking for engineers who are interested in joining any of these squads right now, but there are opportunities to move between them as you gain experience with our platform.
We've posted a good overview of our platform on our blog if you'd like to learn more.
We're investing a lot of up-front effort in building a scalable, secure, and extensible architecture for our millions of customers. Come and help us build a state-of-the-art microservices platform and build the kind of bank you want to use.
Our engineers have a variety of different backgrounds
We have several non-graduates; only some of us studied Computer Science; some of us have worked in huge companies; some have only ever worked in startups; others are former consultants. As long as you enjoy learning new things, we'd love to talk to you. We do not ask for formal qualifications or degree requirements for any of our engineering roles.
We are actively creating an equitable environment for all of our engineers to thrive
Diversity and inclusion are a priority for us and we are making sure we have lots of support for all of our people to grow at Monzo. We provide a sponsorship framework in Engineering for women and people of colour; all of our leaders are trained on privilege awareness and we are creating partnerships with organisations dedicated to supporting underrepresented groups. You can read more in our 2020 Diversity and Inclusion report.
Monzo works in project-based sprints in small, interdisciplinary teams
We have around 150 engineers out of roughly 1,400 people in total - and we have big ambitions. There are many interesting challenges ahead, and we're happy for people to move between teams or to specialise, whatever you prefer. As an engineer here you'd be able to work directly with anyone across the company, and we run regular knowledge-sharing sessions so you'll learn heaps about everything from how banks work to effective communication.
We encourage an open and transparent working environment
You can get involved in any aspect of the business you are interested in and, following Stripe's example, all emails in the company are visible in an email archive. We contribute to open source software as much as possible. We've also made our product roadmap public and give sneak peeks of features in our community forum. Our technology blog is a good place to learn even more about what we do!
At Monzo you will get to work with a lot of exciting new technology.
We rely heavily on the following tools and technologies:
Go to write our application code (we also use Go to write software to control and manage our platform)
AWS for most of our infrastructure
Kubernetes to schedule and run our services (Chris, our Technical Director of Platform and Reliability and Suhail, a Staff Engineer in our Platform Collective gave a great talk recently at re:Invent sharing an overview of our platform)
Prometheus to monitor everything! (see How we Monitor Monzo)
Envoy Proxy for our Service Mesh
Kafka for our asynchronous message queue
Cassandra for most persistent data storage
We also have three physical data centre sites with a number of leased lines to connect our cloud infrastructure to various payment systems
You should apply if:
Our open roles are for mid-level to senior candidates at present. Apply if:
the work we're doing sounds exciting!
you're a software engineer at heart and you're comfortable writing software to solve problems
you're interested in distributed systems and writing resilient, scalable software
you have strong experience working on the backend of a technology product
you're familiar with some of our Platform technologies, or specialise in just one part
you want to help build, scale and operate a platform to support a product that you (and everyone you know) use every day
you're keen to learn more about new technologies and the arcane inner workings of the financial industry
you're comfortable working in a team that deals with ambiguity
Logistics
Salary ranges between £70,000 - £116,000 plus stock options and other benefits.
We can help you relocate to London & we can sponsor visas.
This role can be based in our London office, but we're open to distributed working (as long as you can occasionally visit our London offices - usually a couple of days a month).
We're usually always hiring for engineers, so there's no closing date for this job.
We offer flexible working hours and trust you to work enough hours to do your job well, at times that suit you and your team.
Diversity and inclusion is a priority for us – if we want to solve problems for people around the world, our team has to represent our customers. So we need to attract the best talent and create an environment that supports and includes them. You can read more about diversity and inclusion on our blog.
If you prefer to work part-time, we'll make this happen whenever we can - whether this is to help you meet other commitments or strike a great work-life balance.
Our interview process is normally a phone interview, a coding task and call to discuss it, and 2-3 hours of onsite interviews that can be conducted via hangouts as well. We promise not to ask you any brain teasers or trick questions. We might design a system together on a whiteboard, the same way we often work together, but we won't make you write code on one.
Equal Opportunity Statement
At Monzo, embracing diversity in all of its forms and fostering an inclusive environment for all people to do the best work of their lives with us. This is integral to our mission of making money work for everyone.
We're an equal opportunity employer. All applicants will be considered for employment without attention to ethnicity, religion, sexual orientation, gender identity, family or parental status, national origin, veteran, neurodiversity status or disability status.
#LI-Remote
#LI-TT1"
53,53,Software Engineer,Silktide,https://uk.indeed.com/rc/clk?jk=8447e24a656ec318&fccid=45234a306888ad5d&vjs=3,,Derby DE24 8HR Remote,"£35,000 - £45,000 a year","You have at least 2 years commercial experience using PHP & MySQL.
You enjoy autonomy and like to take ownership.
Gym membership of your choice.","What is Silktide?
Silktide’s mission is to make the web better for everyone.
We make software to test and improve websites. Organisations around the world use Silktide to help deliver great web experiences that are accessible to all.
Our customers include FORTUNE 500 companies, universities, governments, and web design agencies.
We cover almost every aspect of the web, including accessibility, marketing, content, and privacy. A big part of our work is helping people understand these complex areas in a way that works for them.
Where is Silktide going?
Silktide is self-funded and is more than doubling in size each year. This growth will continue to accelerate and with that in mind, we need to expand our Engineering team to meet the needs of our increasing customer base.
We have ambitious plans to improve the quality of the web. We believe every website should be accessible, compliant, and of high quality. Our Silktide Monitor platform is the first step in our mission. It helps web teams and content contributors with a mixed range of abilities to easily manage hundreds of thousands of web pages.
If you want to help us in our mission to make the web more accessible, then it’s never been a more exciting time to join Silktide!
What we’re like
We heavily promote an open culture. Every member of our team keeps a Slack journal, to log their thoughts, work, and ideas. Everyone can read these. Want to know exactly what your CEO is working on? Done.
Freedom is key to Silktide. We’ll give you the freedom to choose your work, your tech, your working hours, and of course, your location! We don’t clock in and out, in fact, we don’t check your hours. As long as your work is done, the rest is up to you.
We’re growing fast and need smart, ambitious, and trustworthy people to join our team.
What will you be doing?
If you’re looking for an opportunity to learn and expand your skills within Software Engineering with a fast-growing SaaS business, Silktide is for you.
As a Software Engineer at Silktide, you’ll be helping with the day to day management of the Silktide platform, a platform that is used by amazing organisations around the world - the World Health Organization, eBay & Santander to name a few!
You’ll have the opportunity to learn about and use the latest technology to solve problems faced by our customers and get involved in the development of new features and products. You’ll be expected to keep innovating and come up with new ideas on how to improve our platform.
You’ll be provided full training on all aspects of the business, the products, the services offered, and most importantly, you’ll learn a tonne about SEO, Accessibility, Web Governance, and more.
There will be loads of space for creativity, autonomy, developing your skills, and putting your stamp on Silktide.
Where you will be working
It’s up to you. We are a remote-first company. This was a deliberate choice before COVID-19 made it cool — We value work-life balance and hate sitting in traffic.
We’re currently looking for a United Kingdom resident for this remote-based role.
You should join us if:
You have at least 2 years commercial experience using PHP & MySQL
You enjoy autonomy and like to take ownership
You are efficient, proactive, and super organised
You have an excellent understanding of technology
You are a team player and want to be part of a fast growing business
You are ambitious, with the desire to learn
You are someone that will speak up when something is not right
If you have any experience using CI platforms or Amazon Web Services then this will be a bonus
You should not join us if:
You shy away from fast-paced environments
You are worried about telling your boss he is wrong
You need someone to tell you exactly what to do
You don’t like lofty goals
What will you get in return?
Flexibility to work where you like, whenever you like
Salary of £35,000 - £45,000 depending on experience
Choice of your own laptop + home office budget
Gym membership of your choice
2 weeks / year dedicated to skills development (“Silktime”)
20 days paid holiday + public holidays (increases with each year at Silktide)
Training budget
Annual company retreat (2022 is Barcelona)
Development opportunities – we are growing quickly which opens plenty of doors for career development
Random gifts that turn up on your doorstep courtesy of our Happiness Manager
Work for an inspiring, people-centric company that is working to improve the quality of the web
Interested? Fill in the form below with your CV.
This is a remote-working opportunity.
This position requires you to be a resident of the United Kingdom."
