,Unnamed: 0,Title,Company,Links,Ratings,Address,Salary,Job description,full-description
78,78,Software Engineer,MBDA,https://uk.indeed.com/rc/clk?jk=7f1618b7c80565a5&fccid=d2734ffcb9518ed3&vjs=3,3.8,Bristol,"£60,000 a year","Our team works across new and existing software products building overall product knowledge.
We develop and support a wide variety of software products ranging…","MBDA Missile Systems - Deliver for a more secure tomorrow
Salary: up to £60,000 (doe)
Benefits: *Flexible working *opportunities for career progression *paid overtime (subject to level) *great bonus scheme *comprehensive pension scheme *annual salary review *fantastic working environment and site facilities *social, charitable and sporting activities.
We are interested in Software Engineers who would love to join us in Bristol as part of a dynamic team to develop and deliver innovative solutions by exploiting a wide portfolio of software technologies.
We are committed to developing careers and skillsets by supporting our engineers personal development whilst ensuring that a healthy work/life balance is maintained!
What were looking for
While we will look for you to have experience in these, if you do not have some of them dont let that stop you from applying.
Working within teams
Evidence of self-development
Worked with a variety of programming languages
Agile practices such as scrum
Writing code with test-driven development
Familiarity with architectural and design patterns
Additional experience in any of the following areas would be advantageous.
Windows and/or Linux administration
Continuous Integration and Testing implementation
Virtualisation
Whats in it for you?
We develop and support a wide variety of software products ranging from Graphical User Interface to Application level business logic across a broad range of our weapon system products.
Our team works across new and existing software products building overall product knowledge. It involves all aspects of the software development lifecycle with a supportive team.
We use a broad range of software technologies and tools including C++, Java, C#, DDS, Web Services, Qt, Linux and Windows depending on the needs of the project.
Join a great team!
We are a strong cohesive team with an open and supportive approach to software development.
A dynamic team passionate about developing and delivering innovative solutions
Why us?
MBDA is an award winning company; committed to providing an inclusive working environment where our employees can be themselves and everyone has equal opportunity to reach their full potential. We value difference and know that a diverse community makes for greater innovation and brings a breadth of skills, experience and perspectives.
Were here to help and want to ensure you have a positive experience throughout our recruitment process. We recognise that everyone is unique and we encourage you to speak to us should you require any advice, support or adjustments.
MBDA is a proud member of Working Families the UKs work-life balance organisation. We welcome applicants who are looking for flexible working arrangements.
We understand that flexibility benefits our people, our teams and our business; wherever possible we will seek to accommodate a blended approach to on-site and remote working.
Follow MBDA on LinkedIn (MBDA), Twitter (@MBDAcareers) and Instagram (lifeatMBDA_UK).
Please Note: MBDA UK requires all employees to achieve the appropriate clearance relevant to the role.
#LI-RS1"
79,79,Apprentice Developer,London Borough of Barking and Dagenham,https://uk.indeed.com/rc/clk?jk=a7a4f908d2533783&fccid=2178b2e6f3462343&vjs=3,3.9,London Remote,"£19,801 a year",IMPORTANT : Apprenticeship opportunities are for residents only of London Borough of Barking & Dagenham and care leavers should be offered an interview if they…,"REF
COPO00020
DIVISION
IT Services
CONTRACT TYPE
Apprenticeship
SECTION
Chief Information Officer
SALARY MIN
£19,801
SALARY MAX
£19,801
INTERVIEW DATE
17/01/2022
CLOSING DATE
05/01/2022
About this job
The Council is on a journey of transformation driven by the ambition 2020 programme that will deliver a new kind of Council, one able to meet both current and future challenges. The Council's IT service is a key element of this business transformation. Key to this future will be an understanding of the technology & data needs of Council services and companies so that the IT Service can best support them. Reporting to the Council’s Application & Data Manager, the apprentice developer is responsible for the development, support, and configuration of software systems to meet this challenge. The role holder will work across the Applications team and be primarily working in conjunction with the Developers to; learn about the software system architecture, the different systems in use, their purpose and integration, create GOSS/Cypad forms, development in SQL, Azure Logic Apps, Web API, JavaScript, Python, Frameworks and SQL Server Integration Services (SSIS) scripting, systems configuration such as JRNI Booking systems, act as a key technical support point of contact for the provision of Business as Usual (BAU) support and project resource. In these difficult times, we need to work differently, we expect that this role will be mainly home based and that you will be able to work remotely for protracted periods of time. The role requires that you are able to travel to meetings in Barking & Dagenham if required. Such travel will not be expensed by the Council.
Special requirements for this post
IMPORTANT : Apprenticeship opportunities are for residents only of London Borough of Barking & Dagenham and care leavers should be offered an interview if they meet the minimum criteria Work in the capacity of an apprentice software developer, responsible for self-improvement, learning, research and working with Developers or other colleagues to support our software systems, integrations, and data flows. Knowledge and understanding of programming constructs, logic, and data flows with a aptitude towards coding.
About you
Application and Data Manager responsible for the portfolio of applications and associated data they gather, storage, governance and control through consumption and analytics. Managing a wide range of applications made up of legacy, COTS and bespoke applications.
About us
The Council is on a journey of transformation driven by the ambition 2020 programme that will deliver a new kind of Council, one able to meet both current and future challenges. The Council's IT service is a key element of this business transformation. Key to this future will be an understanding of the technology & data needs of Council services and companies so that the IT Service can best support them."
80,80,Software Integration Engineer,Noa,https://uk.indeed.com/rc/clk?jk=cc435eeb76cc6e34&fccid=c9be8141a4ec5350&vjs=3,,Milton Keynes Remote,"£70,000 a year","Their UK office is based in Milton Keynes and the work from home expectation is flexible to suit you.
Excellent experience developing bespoke integrations with…","Software Integration Engineer – Milton Keynes / Remote UK - £70,000 plus Bonus & Package

We are helping one of Europe’s fastest growing technology companies make a number of tech hires. Due to continued growth and demand for their products they now urgently need a Software Integration Engineer to join their high performing team.

Their UK office is based in Milton Keynes and the work from home expectation is flexible to suit you. You can be fully remote within the UK if you wish.

To be a successful, the ideal candidate will have:
Strong experience in .NET C#
Excellent experience developing bespoke integrations with other systems
Confident working with direct interfacing APIs
WwebAPI 2, .NET API’s
Experience of leading a team would be a bonus
Able to build excellent relationships with other managers and stakeholders
Great personality and naturally collaborative
Friendly, willing to learn and a love of tech
What is in it for you?
Great salary – Up to £70,000 base plus bonus and package
Flexible working
Share Options
An opportunity to work with some of the brightest minds in the tech sector
Please apply with your CV and we will be in touch for a confidential chat.
Noa Recruitment specialise in helping Software and Web Professionals and technical talent find great careers. If this role doesn’t sound like you, but you know a great person who might be interested then please do share these details with them."
81,81,Software Development Tutor (HTML & CSS) - Remote,Learning Curve Group,https://uk.indeed.com/rc/clk?jk=bae86e46e099c120&fccid=03bbabade252c8ac&vjs=3,3.8,Remote,"£28,000 - £35,000 a year","This role requires a highly motivated and self-driven person to deliver teaching, learning and assessment to learners at Learning Curve Group.","Introduction
Learning Curve Group is a national training and education specialist we work with further education providers, employers, and learners to help them achieve success. We have strong values which are all centred around our learners – and that is how we believe it should be, as we impact on over 100,000 of them every year. Our ‘Purple People’, the dedicated and passionate people of LCG, help us to deliver success no matter what, to achieve our vision to ‘transform lives through learning’. You will need these important qualities: • Passion for learning and coaching • Focused on developing the potential in people • Personable and engaging • Organised and self-reliant • Enthusiastic and professional
Key Responsibilities
This role requires a highly motivated and self-driven person to deliver teaching, learning and assessment to learners at Learning Curve Group. You will need to have recent experience in Software Development, HTML & CSS, and will be responsible for delivering relevant and valuable qualifications to learners. The Digital Online tutor will take full responsibility for the effective running of the course and the associated administrative duties in accordance with the funding. Our Digital Online provision is run remotely.

Essential Criteria
Experience working in an technical role - specifically Software Development - HTML & CSS
Vocational experience in the area in what you are applying for
Proven track record of meeting targets
Right to live and work in the UK
Excellent level of IT Skills
Excellent communication and coaching skills
Drive and enthusiastic to support learners
Passionate about transforming people’s lives through learning
Self-reliant and able to manage own workload
Good organisational and planning skills
Ability to work effectively as a member of a team
It would beneficial, but not essential to have:
Recognised teaching or training qualification at Level 3 or above
Previously delivered programming courses for Software Development - HTML & CSS
Full training will be provided, and Learning Curve Group will support you through your Level 3 teaching qualification should be interested in becoming a tutor with us.

Key Responsibilities and Duties

Plan and deliver a training programme with regular reviews of learner progress
Ensure all learner records and reporting kept up to date and provided in a timely manner to support management reporting and audit requirement
Liaise with our Technical trainers/Team to ensure all learners receive regular technical training throughout their programme.
Provide robust exit advise to learners as they set personal goals for career progression (should this recognise IAG across the learning journey as well as end)
Facilitate learning for learners, adhering to the standards of the program to ensure consistency and fairness throughout all teaching, learning and assessment delivery techniques.
Provide meaningful and specific feedback to learners to support progression.
Deliver a balanced KPI’s in line with company expectations
Operate within the delivery framework to maintain operational consistency and ensure learner progress
Ensure all learners receive the highest quality experience in line with company expectations and external requirements.
Maintain and enhance relationships with business support teams to support the delivery of the sector plan
Participate in quality assurance activities working closely with the quality team.
Drive self – generation across the area you operate within
Maintain and enhance relationships with existing learner and clients assuring the Learning Curve Group brand is synonymous with and recognised for quality of service
Ensure CPD is planned and reflects company and stakeholder requirements as guided by the quality team.
Ensure any CPD updates are added to purple people
To be a vocational expert within the designated sector
Contribute to ad hoc cross sector/function projects to support the delivery of Learning Curve Group strategic plan
Role model the organisation’s values and behaviours

Key Performance Indicators
Maintain a caseload level of up to 45 learners
Retention and achievement rates
Less than 5% pass planned end date learners
Regular contact with learners and employers
Although delivery is our passion, it’s important you are comfortable using e-portfolios for the following:
Comprehensive planning – Intent of the session and what teaching strategies.
Resources – What resources you will use during the session e.g powerpoints
Feedback – Feedback on the session, how the learner approached the session and what they gained
Marking – Mapping and giving feedback on work
OTJ – Recording OTJ on learners profiles
Diary Management – Booking sessions through SMARTASSESSOR
Audit trail – Learners not participating, that recording an audit trail on SA.

Benefits
Holidays – 26 days + bank holidays
Pension – 5% from yourself, 3% from LCG
Armed Forces Covenant - Silver
Healthcare and Tech scheme
Social events
Keeping in touch meetings
Amazing Headquarters
CPD

Equal Opportunities
For LCG to really transform lives through learning, it takes diversity of skills, knowledge culture and background. That’s why we're an equal opportunities employer and positively encourage applications from suitably qualified and eligible candidates regardless of sex, race, disability, age, sexual orientation, transgender status, religion or belief, marital status, or pregnancy and maternity.
Essential Criteria
Learners are at the centre of everything we do so we are committed to safeguarding and promoting their welfare. If applicable, the successful applicant will be required to provide satisfactory references and prove their eligibility to work in the UK. Dependning on your role, we may also need to carry out a DBS check."
82,82,Senior Software Engineer,WeGift,https://uk.indeed.com/company/WeGift/jobs/Senior-Software-Engineer-5656a2d18e73cad9?fccid=189900460d1d38f9&vjs=3,,London,"£60,000 - £75,000 a year","A passion for promoting software engineering best practice, guiding and mentoring more junior engineers to deliver clean, scalable, and reusable code.","Now more than ever, people want every experience to be instant and on-demand. And when it comes to getting paid, people want their cash yesterday. But every year organizations waste time, money and energy sending more than $20 trillion in payouts to individuals using cash, checks, credit, debit, prepaid and gift cards! Held back by the legacy banking systems, crushed by the costs and complexity of credit cards there is this monster industry still lingering in the digital dark ages.
At WeGift we’re changing all that. We’ve built our own proprietary payment rails that enables any organisation to send money to any individual, anywhere, instantly. No bank account required. No insane interchange fees. We even get up to 20% in commissions from retailers for driving sales which we pass onto our customers. It’s discounted money! We’re throwing away the old model, and transforming how we move and use money forever.
We want amazing people like you to join us and be part of that journey.
We are an equal opportunity employer and value diversity at our company. We do not discriminate on the basis of race, religion, colour, national origin, gender, sexual orientation, age, marital status, veteran status, or disability status.
For this role, we are able to sponsor candidates who require a Tier 2/skilled worker visa. We also offer a relocation package to help with your move to the UK.
You can read more about our team here: Diversity & Inclusion
Requirements
Our Team
We’re building a Product & Engineering team where people can do their best work that sits right at the heart of the business. We want to hire talented engineers who see WeGift as an opportunity to grow and to make an impact.
We have Python and TypeScript services running across Kubernetes (EKS) and Lambda functions. Our persistence is largely Aurora (Postgres), DynamoDB and their event triggers.
We have structures in place from hiring and levelling to how we make technical decisions that will allow the right people to thrive and we want world class engineers to be a part of that journey. We welcome applications from engineers from any programming language that are enthusiastic about cross-training to Python and Typescript.
The Role
As a Senior Software Engineer, you will be responsible for architecting, implementing and deploying software services from end to end. You’ll produce clean, scalable, and reusable code to build products which will have a big impact on our customers.
You will have the opportunity to work with a modern stack and serverless cloud infrastructure whilst guiding and mentoring more junior engineers in the team.
*
What Excites You*
Contributing towards the design, delivery and deployment of large scale, complex projects which are used heavily by thousands of people with high throughput.
Using modern technology like AWS serverless infrastructure and events driven microservice architecture
Mentoring more junior members of the team to help support their growth and development and to ensure the team is levelling up.
Being a subject matter expert on technology and domain-specific problems, and taking ownership of software services from end to end.
Improving responsiveness and overall performance of our web services.
Helping to scale the team by leading on technical interviews.
What Excites Us
Around 5+ years of Software Engineering experience architecting and developing new services and features from end to end.
The ability to take ownership of design and architecture of large scale systems and developing API heavy software solutions without the need for guidance.
A passion for promoting software engineering best practice, guiding and mentoring more junior engineers to deliver clean, scalable, and reusable code.
Proactively contributing to the continual improvement of our engineering processes
Some of the project you could be working on:
Integration into all physical stores and merchants with POS. Consumers can spend their value where they want to as we go beyond Gift Cards.
Continued development of our infrastructure. Transitioning to serverless infrastructure and microservices to enable us to scale rapidly as a team
Building a brand new internal tool chain. So non technical teams can on-board new payment partners
Building our wallet feature. Consumers can aggregate the value they accumulate and spend that digital value when and where they choose to.
Technical resilience. As we become more integral to our customers’ businesses, how can we make sure that we can continue to serve them even when there are technical or logistics issues upstream.
Recent examples of new features:
WeGift Select. This allows us to give the customer choice, and therefore go beyond simply reselling gift cards and towards our strategic vision of helping value to flow more freely in the global economy. This project was technically challenging due to a requirement for it to work across a wide selection of devices.
Self-serve brand on-boarding. WeGift is growing rapidly, which means we have to challenge ourselves to use technology to give a great experience to our brand partners without them needing a lot of support from the customer success team.
Ongoing integration with gift card processors. Right at the heart of WeGift’s operations, this technology needs to scale seamlessly and maintain high standards of reliability, maintainability and security. We’re also constantly asking ourselves how we can make this process more efficient - how can we make a capital investment now to reduce operational spend in the future, and that in turn requires a creative take on the underlying technology.
Benefits
Take a look under the hood of life at WeGift from our employees perspective. This handbook built using Notion.so is what we use to navigate both the serene and choppy waters when needed. You might need to copy and paste the following link into your browser as job boards don't allow us to add hyperlinks - https://bit.ly/2PluGyG
Private Medical Health Insurance with Bupa.
Visa sponsorship and relocation package opportunities.
A minimum of 25 days holiday + bank holidays (we’re not too descriptive about holidays so if you need more time off then just ask).
Participation in the Employee Options pool giving you ownership in WeGift and participation in the upside.
Pension scheme (3% contribution)
For the time being we are a remote-first company, however, from January 2022 we will be moving to a more hybrid structure to allow flexibility between home and office based working. You will therefore be expected to be in our London office (145 City Road, nr Old Street) a set number of days a month, agreed by your manager.
Generous maternity and paternity packages to make sure you get to spend time with your new bundle of joy.
£1,000 annual L&D allowance to invest in mastering your craft, including accredited studies.
Cycle to work scheme - save some £££ on buying a bike.
Regular virtual team socials.
Workplace Nursery benefit, where WeGift makes a contribution to your child's nursery for equipment, training, redecoration or anything else
WeRecognise, where we shine the spotlight on exceptional employees every quarter who in turn get a £200 award in the eGift card of their choice.
Staff perks with WeGift brands - discounts of up to 12% on coffee, weekly groceries, holidays, the list is endless.
Senior Software Engineer
Job Type: Full-time
Salary: £60,000.00-£75,000.00 per year"
