,Unnamed: 0,Title,Company,Links,Ratings,Address,Salary,Job description,full-description
22,22,Backend Engineer,Monzo,https://uk.indeed.com/rc/clk?jk=041dc842f283eec5&fccid=73da13d58dc1080c&vjs=3,3.9,London Temporarily Remote,"£90,000 - £116,000 a year","You're interested in distributed systems and writing resilient software.
Kafka for our asynchronous message queue.
React for internal web dashboards.","At Monzo we're aiming to build the best current account in the world. We are always keen to hear from capable, creative engineers who want to help us accomplish that goal
Our backend engineers have a variety of different backgrounds
We have several non-graduates; only some of us studied Computer Science; one of the team has a degree in Marketing; some of us have worked in huge companies; some have only ever worked in startups; others are former consultants. As long as you enjoy learning new things, we'd love to talk to you. We do not ask for formal qualifications or degree requirements for any of our engineering roles.
We are actively creating an equitable environment for all of our engineers to thrive
Diversity and inclusion are a priority for us and we are making sure we have lots of support for all of our people to grow at Monzo. We provide a sponsorship framework in Engineering for women and people of colour; all of our leaders are trained on privilege awareness and we are creating partnerships with organisations dedicated to supporting underrepresented groups. You can read more in our 2020 Diversity and Inclusion report.
We encourage an open and transparent working environment
You can get involved in any aspect of the business you are interested in and, following Stripe's example, all emails in the company are visible in an email archive. We contribute to open source software as much as possible. Our blog is a good place to learn even more about what we do!
Monzo works in project-based sprints in small, interdisciplinary teams
We have around 150 engineers out of roughly 1,400 people in total - and we have big ambitions. There are many interesting challenges ahead, and we're happy for people to move between teams or to specialise, whatever you prefer. As an engineer here you'd be able to work directly with anyone across the company, and we run regular knowledge-sharing sessions so you'll learn heaps about everything from how banks work to effective communication.
At Monzo you will get to work with a lot of exciting new technology.
We rely heavily on the following tools and technologies:
Go to write our application code (there's an excellent interactive Go tutorial here)
Cassandra for most persistent data storage
Kafka for our asynchronous message queue
Envoy Proxy for RPC
Kubernetes and Docker to schedule and run our services (Oliver, our VP Architecture, gave a great talk at KubeCon on how we use these technologies)
AWS for most of our infrastructure
React for internal web dashboards
We also have two physical datacenter sites with actual cables to connect to various third parties
Our product squads are truly cross-functional.
This role is all about collaborating across disciplines to test hypotheses and make a difference to customers. As a product backend engineer you'll work in a squad alongside product managers, marketers, user researchers, designers, mobile engineers, web engineers, data analysts, business analysts, writers and more!
Together you'll build and support a particular part of Monzo. Our product squads belong to one of four collectives (a word we use to describe self-governing business units of ~100 people). They are: Growth & Core, Borrowing, Operations and Money. They're all looking for additional Backend Engineers right now.
The Growth & Core collective helps people to discover Monzo and make the most of it.
Growth & Core is a collective focused on different aspects of our mission to 'make money work for everyone' and it has four squads. They make users effortlessly financially savvy with features like Budgeting, Pots and the Salary Sorter. Many of the customer problems they solve are revenue opportunities, too – like Monzo Plus, Business Banking, and the Savings marketplace. Last year they also launched our Open Banking APIs, shipped a simpler and more future-proof navigation structure, and enabled Monzo customers to get their salary paid a day early for free!
The Borrowing collective makes borrowing money simple, fair and transparent.
We're really proud that this fair approach to lending helps people to get what they want from life on their own terms. Squads in Borrowing have already shipped and scaled overdrafts to hundreds of thousands of Monzo customers. They've made it easy to take out a loan without the unfair fees or confusing pricing that you find elsewhere. They work on everything from the way borrowing works in the app, right down to how they move and account for money that our customers borrow. One of the most interesting problems they face is deciding how much to lend and to whom. The team believes that they can make access to credit fairer and more transparent.
The Operations collective is responsible for our incredible customer support.
The Operations collective looks after one of the most interesting problem spaces at Monzo: as we grow, we want to ensure that we're using technology as effectively as possible whilst still maintaining customer service so good that you want to tell your friends. Our engineers within this area of the business help us to explore these challenges. Central to it all is Monzo Chat – a completely bespoke bit of software we've built from the ground up to manage chats in our app - but we're also doing work with machine learning, and looking at how technology can more broadly support our wonderful support team (we call them COps) in other aspects.
The Money collective helps Monzo move fast and in control with our money
We are the bank within the bank and are responsible for the core infrastructure and banking services you associate with Monzo. We are the Guardians of the Monzo Ledger and own everything related to our distinctive Hot Coral cards.
Engineering squads within the Money collective carry out a variety of payments and finance related work, we built our very own Mastercard processor from scratch and recently we successfully replaced a third-party Faster Payments Gateway with our own internal Gateway to reduce outages we can't control. On top of this we've been ensuring our payment schemes are compliant with key regulatory requirements such as Strong Customer Authentication (SCA), 3D Secure V2 (3DSV2), making sure that our core infrastructure and services will scale to support our ambitious growth plans and that we always know where our money is and can report accurately and reliably on it.
The financial crime at Monzo team focuses on making sure our services are a hostile environment for criminals
We tackle all financial crime together as one team, this includes money laundering, fraud, sanctions breaches, terrorist financing, bribery and corruption and tax evasion. Engineers get to work on core services that are consumed by many different products which means we have a really broad perspective. We've had some major successes in combating financial crime, most famously The Ticketmaster Breach where we spotted large-scale fraudulent activity due to a Ticketmaster data breach before Ticketmaster or other banks did.
The TechOps team
The TechOps team are challenging the traditional IT model by building a brand new people platform to automate all aspects of a Monzo staff member's time here. We're building an industry leading people platform to support our staff in a delightful way and to accommodate rapid growth across multiple countries. This approach will allow us to empower our staff by providing smart, efficient and powerful tools instead of relying on traditional IT systems and a horde of IT staff.
You should apply if
Our open roles are for mid-level to senior Backend Engineers at present.

you have strong experience working on the backend of a technology product
you think you'd enjoy the kind of work we're doing
you want to be involved in building a product that you (and the people you know) use every day
you have a product mindset: you care about customer outcomes and you want to make data-informed decisions
you're comfortable working in a team that deals with ambiguity
you're interested in distributed systems and writing resilient software
you have some experience with strongly-typed languages (Go, Java, C, Scala etc.).
Logistics
Salary is around £90,000 - £116,000 plus stock options and other benefits.
We can help you relocate to London & we can sponsor visas.
This role can be based in our London office, but we're open to distributed working (with ad hoc meetings in London once COVID is over).
We're usually always hiring for Backend Engineers, so there's no closing date for this job.
We offer flexible working hours and trust you to work enough hours to do your job well, at times that suit you and your team.
Diversity and inclusion is a priority for us – if we want to solve problems for people around the world, our team has to represent our customers. So we need to attract the best talent and create an environment that supports and includes them. You can read more about diversity and inclusion on our blog.
If you prefer to work part-time, we'll make this happen whenever we can - whether this is to help you meet other commitments or strike a great work-life balance.
Our interview process is normally a phone interview, a coding task and call to discuss it, and 2-3 hours of onsite interviews that can be conducted via hangouts as well. We promise not to ask you any brain teasers or trick questions. We might design a system together on a whiteboard, the same way we often work together, but we won't make you write code on one.
Equal Opportunity Statement
At Monzo, embracing diversity in all of its forms and fostering an inclusive environment for all people to do the best work of their lives with us. This is integral to our mission of making money work for everyone.
We're an equal opportunity employer. All applicants will be considered for employment without attention to ethnicity, religion, sexual orientation, gender identity, family or parental status, national origin, veteran, neurodiversity status or disability status.
#LI-Remote
#LI-TT1"
23,23,Software Engineer,Guardian News & Media,https://uk.indeed.com/company/Guardian-News-&-Media/jobs/Software-Engineer-5c92c59fe445715c?fccid=db4a5cd5f8e4ab03&vjs=3,,London N1,"£49,600 a year","As a full stack engineer, you’ll be equally willing to dive into a purely functional and composable Scala back-end, or a complex JavaScript front-end (using…","The Guardian is one of the world’s biggest liberal news organisations. We are renowned for our groundbreaking independent journalism, our award-winning digital products and excellent engineering team.
We work collaboratively with designers, user experience researchers, and other developers in the team. The majority of our code is openly available on GitHub, and some of our projects are widely used throughout the Open Source community.
We are now looking for a Software Engineer to join the team.
The Software Engineer role:
As a full stack engineer, you’ll be equally willing to dive into a purely functional and composable Scala back-end, or a complex JavaScript front-end (using Flow, TypeScript, Angular, React etc) You won’t necessarily be an expert in everything, but you’ll be eager to learn
You are a creative, passionate, and intelligent person who loves web technologies
As a developer on the team, you will have 2 years commercial experience
You can see the full job description here
We strive for transparency in remuneration. The salary for new developers at The Guardian is £49.6k
What we offer
Flexible working (see below for details)
Generous pension scheme; if you contribute 5% then the Guardian will contribute 8-12% (depending on your age)
Mental and Physical Health insurance and dental scheme
26 days annual leave and the option to purchase an extra 5 days
Up to 18 weeks of parental leave at full pay
Multi-faith prayer room
Cycle to work scheme and subsidised gym membership
Paid volunteering days
Annual season ticket loan
More about flexible working
Due to the ongoing pandemic situation and until further notice, we are currently working remotely and attending the office on a voluntary basis. In September and November we were trialling a hybrid model with team days every week in the office. We will review what we learnt from the trial to evolve the model and provide more flexibility and predictability for individuals, and ensure inclusivity for everyone.
We welcome applicants with diverse backgrounds, different lived experiences and different perspectives. A diverse team means we can better reflect and engage our global audience.
We believe in hiring the best people from the widest pool, and also in including them, fostering a culture where people’s voices can be heard and our employees look forward to coming to work.
Application instructions:
To apply for this position please upload your CV, you must already have the right to work in the UK.
Our interview process involves two stages: a pairing test and a face to face interview.
Find out more about our hiring process here
About Us
We value and respect all differences in all people (seen and unseen) at the Guardian. We aspire to inclusive working experiences and an environment that reflects the audience we serve, where our people have equal access to career development opportunities, their voices are heard and can contribute to our future. The Guardian actively encourages applications from BAME candidates.
At The Guardian, many of our staff work flexibly and we will consider all requests for flexible working arrangements.
Job Number
KIN00022F
Location
Kings Place
Business Area
Technology
Employment Type
Full-time
Job Type: Full-time
Pay: £49,600.00 per year"
24,24,Software Engineer,Tech Returners,https://uk.indeed.com/company/Tech-Returners/jobs/Software-Engineer-f0ab8429d0695d33?fccid=5db9b8b61558c34c&vjs=3,,Watford+17 locations Remote,"£49,000 - £65,000 a year","Have previous experience of being a software developer/engineer* (hands-on coding).
Tech Returners is partnering with *The Guardian* to recruit 16 software…","Role: Full Stack Developer
Location: UK – London, flexible working
Salary: Developer salaries start from £49,600 depending on experience.
Available positions: 16
Programme duration: 12 weeks
Tech Returners is partnering with The Guardian to recruit 16 software developers to their engineering team.
Are you an experienced mid-level software engineer looking to return to your career following a career gap?
Would you welcome the opportunity to refresh your skills in Software Development Fundamentals, Frontend, and Backend technologies, receive career readiness and confidence coaching, and then be supported to secure a permanent role at the end of the programme?
Tech Returners provides is the UK’s only free and accessible Your Return to Tech programme for individuals returning to a software engineering role following a career break.
The programme involves training and coaching from our expert team over 12-weeks using interactive digital learning platforms, where you will be upskilled in the latest technologies.
Full-Stack Developer Role
As a full-stack developer, you’ll be willing to dive into a purely functional and composable Scala back-end, or a complex JavaScript front-end (using TypeScript, Angular, React etc) however you don't experience in all of these technologies.
You won’t necessarily be an expert in everything, but you’ll be eager to learn
You are a creative, passionate, and intelligent person who loves web technologies
Your interests go beyond just your team’s objectives; you are curious about where the organisation is moving as a whole
You can make reasoned choices regarding what technologies to use and when to use them.
Benefits of working with The Guardian
10% time
Flexible working
8-12% (depending on your age)
Mental and Physical Health insurance and dental scheme
26 days annual leave and the option to purchase an extra 5 days
Up to 18 weeks of parental leave at full pay
Multi-faith prayer room
Cycle to work scheme and subsidised gym membership
Paid volunteering days
Annual season ticket loan
Am I eligible?
To qualify for this programme, you’ll need to:
Have previous experience of being a software developer/engineer (hands-on coding)
Do you have experience of one or more of the following technologies; JavaScript, TypeScript, React.js, C#, Java, Python, C++ or Scala? If so, please apply.
Have had a period away from your career (including maternity, paternity leave but not limited too)
Be looking to return to technology with The Guardian via the Your Return to Tech programme
What are we looking for?
A creative, passionate individual who loves web technologies and pairing/mobbing
An outward thinker, and the desire and willingness to learn more and be commercially aware
Strong interest in growing your skill and an inclusive approach to problem-solving
Successful applicants will need to be within commuting distance of London as The Guardian is expecting to adopt hybrid working; a combination of working from home with regular travel to the head office in London 2 days a week.
Interested?
This programme starts on Monday 7th February 2022.
Interviews for permanent roles with The Guardian will commence upon completion of the programme on the week commencing Monday 6th June 2022.
How do I apply?
To be considered for this programme, please click the Apply Now button.
Applications for Your Return to Tech February 2022 are now open until Monday 30th Jan 2022 - 23:59 GMT.
Reference ID: 001_Guardian
Part-time hours: 37.5 per week
Expected start date: 07/02/2022
Job Types: Full-time, Part-time, Permanent
Salary: £49,000.00-£65,000.00 per year
COVID-19 considerations:
All interviews are conducted via Zoom"
25,25,Apprentice Software Developer,ITVET,https://uk.indeed.com/company/ITVET/jobs/Apprentice-Software-Developer-f2667e1bec3bd4a1?fccid=e84efe7262886e4d&vjs=3,,Bishop's Stortford,"£23,000 - £27,000 a year","Keep fit and healthy with a fitness allowance.
Successful candidates are subject to a basic DBS check.","The software development arm of the ITVET group offers a range of Cloud SaaS based software applications, which are groundbreaking in their own right, and developed on the Azure platform using the very latest micro-services.
We are looking for talented trainee software developers to join one of our Software Services teams. If you are passionate about coding, and are looking to start your career in development, love working in a team, and want to create innovative and unique software, we want to hear from you. Unlike other trainee-level roles, you will be paid a decent salary whilst you learn, as we believe its only right that you should be rewarded for your efforts.
We are a Microsoft House, and as such we use C#, .NET for our back-end, and Angular for our front end. Whether you are interested in back-end, front-end, or even graphic design, this is a great opportunity for you to hone your skills and do something you are passionate about. Using the very latest technologies too.
What you’ll learn as a ITVET Trainee Software Developer:
You’ll gain skills using a modern object-oriented language – we predominately use C#.
You’ll learn how we make ingeniously simple software
You’ll work in a highly collaborative team of developers who are enthusiastic about all things code and tech. But still like to have fun too!
You’ll gain experience working within an agile development team, using practices such as TDD, BDD and continuous delivery.
As well as a generous salary we offer an excellent range of benefits:
Pension plan
Keep fit and healthy with a fitness allowance
Private Health insurance
29 days holiday
Virtual social calendar of events
We are proud to be a company that is different, but not just for the sake of it. We take great pride in the fact that we are a community, and as a community, everyone contributes and is treated equally. We operate a performance-based profit share scheme, so everyone can enjoy our not insubstantial successes.
At ITVET group we are committed to breaking the boundaries in IT Managed Services. Our passionate, expert team is dedicated to driving technology forward, through innovation and perseverance. We are proud to be a company that is different, but not just for the sake of it. We take great pride in the fact that we are a community, and are on an exciting journey that everyone takes part in
Successful candidates are subject to a basic DBS check.
Job Type: Apprenticeship
Salary: £23,000.00-£27,000.00 per year"
26,26,Apprentice Software Developer,ITVET,https://uk.indeed.com/company/ITVET/jobs/Apprentice-Software-Developer-f2667e1bec3bd4a1?fccid=e84efe7262886e4d&vjs=3,,Bishop's Stortford,"£23,000 - £27,000 a year","Keep fit and healthy with a fitness allowance.
Successful candidates are subject to a basic DBS check.","The software development arm of the ITVET group offers a range of Cloud SaaS based software applications, which are groundbreaking in their own right, and developed on the Azure platform using the very latest micro-services.
We are looking for talented trainee software developers to join one of our Software Services teams. If you are passionate about coding, and are looking to start your career in development, love working in a team, and want to create innovative and unique software, we want to hear from you. Unlike other trainee-level roles, you will be paid a decent salary whilst you learn, as we believe its only right that you should be rewarded for your efforts.
We are a Microsoft House, and as such we use C#, .NET for our back-end, and Angular for our front end. Whether you are interested in back-end, front-end, or even graphic design, this is a great opportunity for you to hone your skills and do something you are passionate about. Using the very latest technologies too.
What you’ll learn as a ITVET Trainee Software Developer:
You’ll gain skills using a modern object-oriented language – we predominately use C#.
You’ll learn how we make ingeniously simple software
You’ll work in a highly collaborative team of developers who are enthusiastic about all things code and tech. But still like to have fun too!
You’ll gain experience working within an agile development team, using practices such as TDD, BDD and continuous delivery.
As well as a generous salary we offer an excellent range of benefits:
Pension plan
Keep fit and healthy with a fitness allowance
Private Health insurance
29 days holiday
Virtual social calendar of events
We are proud to be a company that is different, but not just for the sake of it. We take great pride in the fact that we are a community, and as a community, everyone contributes and is treated equally. We operate a performance-based profit share scheme, so everyone can enjoy our not insubstantial successes.
At ITVET group we are committed to breaking the boundaries in IT Managed Services. Our passionate, expert team is dedicated to driving technology forward, through innovation and perseverance. We are proud to be a company that is different, but not just for the sake of it. We take great pride in the fact that we are a community, and are on an exciting journey that everyone takes part in
Successful candidates are subject to a basic DBS check.
Job Type: Apprenticeship
Salary: £23,000.00-£27,000.00 per year"
27,27,Java Software Engineer,Synapri,https://uk.indeed.com/rc/clk?jk=0acf0b7c6016cb31&fccid=447163ca34a4b3d8&vjs=3,,Remote,"£70,000 - £90,000 a year","This organisation has taken a remote-first approach and whilst they have an office in London, they are happy for their staff to work 100% remotely.","Java Developer required on a permanent basis for a leading provider of integrated software solutions. This organisation has taken a remote-first approach and whilst they have an office in London, they are happy for their staff to work 100% remotely.

The successful candidate will have extensive experience working with Java in modern cloud environments that utilise microservices architecture and will be joining an established team to develop maintain and develop new solutions that are provided to their clients. In addition to this, experience working with AWS, Spring Boot, Java Spring framework, REST API development and SQL is highly desirable.

Experience required:
Java development experience
Microservices architecture experience
Experience working with AWS
Spring Boot development experience (Highly desirable)

If this Java Developer role sounds of interest, pleaSe apply now for immediate consideration."
