,Unnamed: 0,Title,Company,Links,Ratings,Address,Salary,Job description,full-description
0,0,Software Engineering - Graduate Programme,NatWest Group,https://uk.indeed.com/rc/clk?jk=8f62b7b76b6e98c5&fccid=4a3a2b1eb3ec0691&vjs=3,3.2,London,"£31,850 a year",Build the technical skills needed as you move through your placements across Technology to become a highly capable software engineer.,"Our people work differently depending on their jobs and needs. From home working to job sharing, visit the remote and flexible working page on our website to find out more.
This role is based in the United Kingdom and as such all normal working days must be carried out in the United Kingdom.
About you
To be eligible for our Software Engineering programme, you’ll need to have, or be on course to achieving a 2:1 in your degree
We’re looking for people who are curious, innovative, customer-focused, and who are able to demonstrate creativity and show a real enthusiasm for technology
In short, you’ll need to be something of an all-rounder; you will take pride in your work and will have a real passion for technology. You will be as comfortable solving technical problems as you are explaining concepts and thrashing out ideas with others
About the programme
As a graduate trainee Software Engineer, we’ll equip you with the knowledge, skills and experiences you’ll need to become a highly capable Software Engineer and make a significant impact. You’ll learn how we’re using technology to redefine the banking experience for our customers. You’ll gain hands-on experience across the full development lifecycle, from requirements analysis through to coding, testing and deployment.
We’ll reward you with a starting salary of £31,850 a year. And on top of your salary, you’ll also have access to our flexible benefits package.
Over the two years on the programme, you’ll:
Complete up-front learning and project activities to get you ready for your first placement
Work collaboratively in an agile environment to deliver technology solutions that meet the needs of our customers and colleagues
Build the technical skills needed as you move through your placements across Technology to become a highly capable software engineer
Gain experience in all aspects of the development lifecycle
Develop the confidence and influencing skills to innovate and challenge the status quo.
About the business area
Technology is crucial to how we operate as a bank and serve our customers. And with over 19 million customers, how we harness its potential is vital.
In Technology, we work closely with all parts of the bank to understand customer and business needs and deliver cutting edge solutions in a dynamic environment. Our customers are at the heart of everything we do; and bringing simple, secure and reliable products and services to our customers is our goal.
Applications for this programme will be open until we receive enough applications to complete our hiring. When that happens, we’ll close the programme to new applications. It’s important to take the time to make sure you’re making the right decision about the programme you want to apply for (you can only apply for one Graduate/Intern programme) but please complete your application as soon as you can to make sure you don’t miss out.
If you need any adjustments to support your application, such as information in alternative formats or special requirements to access our buildings, or if you’re eligible under the Disability Confident Scheme please contact us and we’ll do everything we can to help."
1,1,Software Engineer Apprentice,Lloyds Banking Group,https://uk.indeed.com/rc/clk?jk=52b45930987414a8&fccid=6423597f1cdb7b53&vjs=3,3.8,Bristol,"£27,540 - £32,130 a year","Build simple data models and software designs.
Learn how to write code and operate at all stages of the software development lifecycle.","Please note, this site is only for external candidate applications. If you currently work for Lloyds Banking Group please apply via the internal career site.
Please note: In order to complete an apprenticeship there needs to be a significant learning need. You need to consider your previous qualifications or significant relevant work experience which may mean you cannot proceed with this application.
End Date
Sunday 09 January 2022
Salary Range

Agile Working Options
Job Description Summary
Do you love analysing and solving problems? Do you dream of creating next-generation software with the help of an experienced team? Within Lloyds Banking Group, we’re looking for people with the potential, passion and drive to embark on their journey to become a Software Engineer of the Future.
Job Description
Could you be one of our Engineers of the Future?
Do you love analysing and solving problems? Are you fascinated by the newest tech? Do you dream of creating next-generation software with the help of an experienced team? Do you have an interest in coding / code clubs?
Are you curious about how we're redefining banking to meet our customers’ needs and want to help us to be the best bank for Britain? Are you a strong communicator and a great team player, who is always keen to keep learning and developing?
If this sounds exciting and you want to help build the bank of the future, this Software Engineer Apprenticeship is for you.
Join us and be part of an inclusive, values-led culture that celebrates diversity, equal opportunity and provides opportunities for flexible working. Our approach to inclusion and diversity means that we all have the opportunity to make a real difference, together.
What we're looking for
We’re looking for people with the potential, passion and aim to embark on their journey to become a Software Engineer of the Future. You’ll be a team player who loves using data and tech to find innovative solutions to problems and help the team to deliver the best for our customers.
What you’ll have:
Logical and creative thinking skills
Passion for solving problems
A detailed and organised approach
Ability to communicate in a variety of situations
How will the Apprenticeship programme support you?
Starting in May 2022, you'll be supported by your Line Manager, in work Buddy and Apprenticeship Learning Mentor. Whilst on the Apprenticeship scheme 20% of your time will be dedicated to ‘off the job learning’, which can include attending workshops, shadowing, reading, completing assignments etc. This means 80% of your role is applying your learning in the workplace, in a safe environment.
Once you’ve successfully completed your Apprenticeship, you’ll be a proficient Software Engineer.
As a Trainee Software Engineer, you’ll:
Learn how to write code and operate at all stages of the software development lifecycle
Build, lead and deploy code into customer and business environments
Test code and analyse results
Understand the structure of our Programmes inside out in order to identify and resolve issues
Build simple data models and software designs
Develop skills in agile ways of working
Whilst learning about our current technologies, you’ll build up experience of our systems to support the critical services we provide for our customers. By staying curious about developments in the world of tech, you’ll also have the chance to help build innovative new solutions for our customers.
What is the Eligibility Criteria?
In order to complete an apprenticeship, there needs to be a significant learning need. You need to consider your previous qualifications or significant relevant work experience which may mean you cannot proceed with this application. What this means is that if you have a computer science degree or you have experience in this type of role, you may be over-qualified for this position.
The minimum qualifications required are:
A Level or equivalent qualification in any subject and GCSEs in English Language or Literature and Maths grade C (or equivalent) or above?
Or
A minimum of one year's work experience in a relevant role and GCSEs in English Language or Literature and Maths grade C (or equivalent) or above?
What you’ll get in return
In return, we’ll offer you a competitive package which includes salary, bonus, a generous pension contribution, an attractive path of progression and flex cash to spend on a host of benefits to suit your lifestyle. We have a long track record of flexible working, and we’re always open to new ways to improve our people’s work-life balance, therefore open to discussion on working patterns and working hours.
Lloyds Banking Group is committed to building a workforce which reflects the diversity of the customers and communities we serve, and to creating an inclusive workplace where all our colleagues can be themselves and succeed on merit.
Salary
Starting salary:
Outside of London - £27,540
London - £32,130
Apprenticeships worth discovering
If you’re interested in joining this ground-breaking programme, please register your application and take the first step towards an exciting career in Software Engineering within Lloyds Banking Group. You'll undertake an online test and a virtual assessment centre as part of the selection process.
Interested? What’s stopping you? Apply now!
You might be looking at this vacancy, worrying whether you're right for this role, we know it is daunting thinking about embarking on something new, but apprenticeships are one of the best ways to make this happen. You'll be supported by the team, follow a structured learning programme and learn in a safe environment.
Our roles generate a lot of interest and occasionally we have to close adverts slightly earlier than stated on our website. So if you think working with us could be right for you, please apply now.
At Lloyds Banking Group, we're driven by a clear purpose; to help Britain recover. Across the Group, our colleagues are focused on making a difference to customers, businesses and communities. With us you'll have a key role to play in shaping the financial services of the future, whilst the scale and reach of our Group means you'll have many opportunities to learn, grow and develop.
We're focused on creating a values-led culture and are committed to building a workforce which reflects the diversity of the customers and communities we serve. Together we’re building a truly inclusive workplace where all of our colleagues have the opportunity to make a real difference."
2,2,Software Engineering - Internship,NatWest Group,https://uk.indeed.com/rc/clk?jk=64a0b8982e7fa0fb&fccid=4a3a2b1eb3ec0691&vjs=3,3.2,London,"£21,500 a year","Attend training workshops, get involved with our day to day work, and take part in a business improvement software engineering project.","Our people work differently depending on their jobs and needs. From home working to job sharing, visit the remote and flexible working page on our website to find out more.
This role is based in the United Kingdom and as such all normal working days must be carried out in the United Kingdom.
About you
To be eligible for our Software Engineering internship, you’ll need to be in your penultimate year of university and be on course to achieving a 2:1 in your degree
We’re looking for people who want to start a career in Software Engineering; people who are curious, innovative and customer-focused, and show a real enthusiasm for technology
In short, you’ll need to be something of an all-rounder; as comfortable solving technical problems as you are explaining concepts and thrashing out ideas with others.
About the programme
Over the course of this eight week summer internship, we’ll give you a taste of what it’s like to work with us, along with valuable experience to help guide your career choices.
We’ll reward you with a starting salary of £21,500 pro rata, depending on your location.
For eight weeks, you can expect to:
Learn about our culture, values and goals and build an understanding of the products and services we provide
Attend training workshops, get involved with our day to day work, and take part in a business improvement software engineering project
Develop your team working, planning, creative thinking and problem solving skills
See first-hand how we work together to deliver an outstanding service for our customers
Experience what it’s like to work in a purpose led organisation that puts the customer at the heart of decision making.
About the business area
Technology is crucial to how we operate as a bank and serve our customers. And with over 19 million customers, how we harness its potential is vital.
In Technology, we work closely with all parts of the bank to understand customer and business needs and deliver cutting edge solutions in a dynamic environment. Our customers are at the heart of everything we do: and bringing simple, secure and reliable products and services to our customers is our goal
Applications for this programme will be open until we receive enough applications to complete our hiring. When that happens, we’ll close the programme to new applications. It’s important to take the time to make sure you’re making the right decision about the programme you want to apply for (you can only apply for one Graduate/Intern programme) but please complete your application as soon as you can to make sure you don’t miss out.
If you need any adjustments to support your application, such as information in alternative formats or special requirements to access our buildings, or if you’re eligible under the Disability Confident Scheme please contact us and we’ll do everything we can to help."
3,3,Software Developer,Imperial College London,https://uk.indeed.com/rc/clk?jk=f9f27d3295269f88&fccid=89a1a7b0050ae6e6&vjs=3,4.2,South Kensington,"£39,309 - £48,226 a year","Experience with web software development.
Currently the department is transforming the way in which support is delivered with new processes to improve the…","The Department of Electrical and Electronic Engineering (EEE) is a world-leading department in its field with a reputation for excellence in both teaching and research. Computer software and hardware form the foundation on which our teaching and education support is based. Currently the department is transforming the way in which support is delivered with new processes to improve the student and staff experience.
Duties and responsibilities
The role will be principally concerned with the specification, design and implementation of custom intranet automation to support Teaching and Administration in the department. In addition, the post holder will be responsible for the development of iterative processes to enable rapid identification, costing, and implementation of intranet solutions to new problems within EEE. This work will be carried out in close collaboration with the members of the education support team. The post holder will play a key role in shaping the future student lifecycle support in the department.

Essential requirements


A first degree, or equivalent, qualification in Computer Science or related areas.

Substantial experience in implementation of web - based technologies

Passionate about the use of web technologies to improve user experience.

Experience with web software development

Experience designing and implementing SQL databases and queries

Further information
The appointed candidate will be working at the South Kensington Campus.
For informal enquiries about the post please contact Dr. Tom Clarke: t.clarke@imperial.ac.uk
Further information about the post is available in the job description.
The Department of Electrical and Electronic Engineering has a strong commitment to conducting internationally competitive and innovative research. Its primary scientific interest is in fundamental research with numerous applications to the environment, healthcare, information and communications technology, industry and energy.
The academic staff of the Department of Electrical and Electronic Engineering (EEE) have wide-ranging expertise in Circuits and Systems, Communications and Signal Processing, Control and Power, Intelligent Systems and Networks, and Optical and Semiconductor Devices.
Imperial College London is a science-based institution with the greatest concentration of high-impact research of any major UK university. The Faculty of Engineering, consistently rated among the best in the world, is made up of 10 academic departments and is committed to increasing its research activity by focusing on engineering-led multidisciplinary growth areas that target a number of global challenges. All of our academic departments are located on a single campus in South Kensington, giving a concentration of talent that creates a stimulating and vibrant research community. You can find out more about our staff benefits, including generous annual leave entitlements and our excellent professional development opportunities on our webpages
Documents
Software Developer JD.pdf"
4,4,Graduate Software Engineer (Summer 2022),Gearset,https://uk.indeed.com/rc/clk?jk=4dac96de0896f8b1&fccid=5e59d50f728cbb64&vjs=3,5.0,Cambridge,"£32,000 - £35,000 a year","Enjoy working with a collaborative team of varied disciplines, including software developers, designers, marketers and salespeople.","At Gearset, we build a cutting-edge DevOps solution for the millions of developers building applications on Salesforce. In only three years Gearset has become the DevOps solution of choice for some of the world’s biggest companies, including IBM, McKesson, and even Salesforce themselves.

As a Graduate Software Engineer at Gearset you'll join a passionate and experienced cross-functional development team with a laser focus on quality - from infrastructure, to code, to user experience. The features you build will make thousands of businesses around the world more effective, and joining us as a Graduate, you’ll get stuck into real work solving real problems right from day one.

Who are we?

We're a team of smart, pragmatic people who enjoy giving our best every day to solve our users' problems. We recently received three awards from Best Companies in 2021, putting us in the top 10 best mid-sized companies to work for, the top three best technology companies in the UK, and top 5 best companies in the East of England.

We’re proud of what we’ve built and how we’ve built it. We work as a team, where attributes of trust, openness and honesty are key, as they allow us to have a feedback-driven culture that keeps us always improving. To learn more about what “ good” looks like to us, read about our engineering values here.
You'll be a good fit if you:
Have (or are about to graduate with) a Bachelor's Degree in Computer Science, Mathematics, or a related field
Can write code and solve complex problems
Write well-structured, testable code, with a focus on simplicity and maintainability
Care about quality, not only of the code you write, but of the product you're building
Are interested in both frontend and backend development
Enjoy working with a collaborative team of varied disciplines, including software developers, designers, marketers and salespeople
Have an enthusiasm for working directly with users to build and deliver the right features
Have an innate desire to learn and improve your Software Engineering skills
Working at Gearset, you will:
Maintain and extend existing features, and collaborate with the rest of the development team to spec, design and build new features end-to-end
Learn from a great team - alumni of Microsoft, EA and Cambridge University to name a few
Be assigned a Mentor from day one and be supported by a team of people who enjoy seeing others grow their skills.
Become familiar with a pragmatically-chosen tech stack, including a mix of cutting-edge and proven technologies such as Docker, AWS, C#, React and TeamCity
Work closely with users, delighting them with Software Improvements, researching new features and soliciting feedback
Contribute opinions on a range of topics, from development practices to product strategy and roadmap
Nice to haves:
Familiarity with C# and Javascript
Salary and Benefits:
You'll work 40 hours per week, Monday to Friday, in our Cambridge office, with the option of flexible home working
Salary is £32k - £35k, depending on experience and qualifications
Bupa health care
Life Insurance & Critical Illness cover
Flexible working hours
Free lunch in the office
Discounted gym membership, as well as many other wellness benefits
This role would be for a Summer 2022 start."
5,5,Graduate Software Engineer (Summer 2022),Gearset,https://uk.indeed.com/rc/clk?jk=4dac96de0896f8b1&fccid=5e59d50f728cbb64&vjs=3,5.0,Cambridge,"£32,000 - £35,000 a year","Enjoy working with a collaborative team of varied disciplines, including software developers, designers, marketers and salespeople.","At Gearset, we build a cutting-edge DevOps solution for the millions of developers building applications on Salesforce. In only three years Gearset has become the DevOps solution of choice for some of the world’s biggest companies, including IBM, McKesson, and even Salesforce themselves.

As a Graduate Software Engineer at Gearset you'll join a passionate and experienced cross-functional development team with a laser focus on quality - from infrastructure, to code, to user experience. The features you build will make thousands of businesses around the world more effective, and joining us as a Graduate, you’ll get stuck into real work solving real problems right from day one.

Who are we?

We're a team of smart, pragmatic people who enjoy giving our best every day to solve our users' problems. We recently received three awards from Best Companies in 2021, putting us in the top 10 best mid-sized companies to work for, the top three best technology companies in the UK, and top 5 best companies in the East of England.

We’re proud of what we’ve built and how we’ve built it. We work as a team, where attributes of trust, openness and honesty are key, as they allow us to have a feedback-driven culture that keeps us always improving. To learn more about what “ good” looks like to us, read about our engineering values here.
You'll be a good fit if you:
Have (or are about to graduate with) a Bachelor's Degree in Computer Science, Mathematics, or a related field
Can write code and solve complex problems
Write well-structured, testable code, with a focus on simplicity and maintainability
Care about quality, not only of the code you write, but of the product you're building
Are interested in both frontend and backend development
Enjoy working with a collaborative team of varied disciplines, including software developers, designers, marketers and salespeople
Have an enthusiasm for working directly with users to build and deliver the right features
Have an innate desire to learn and improve your Software Engineering skills
Working at Gearset, you will:
Maintain and extend existing features, and collaborate with the rest of the development team to spec, design and build new features end-to-end
Learn from a great team - alumni of Microsoft, EA and Cambridge University to name a few
Be assigned a Mentor from day one and be supported by a team of people who enjoy seeing others grow their skills.
Become familiar with a pragmatically-chosen tech stack, including a mix of cutting-edge and proven technologies such as Docker, AWS, C#, React and TeamCity
Work closely with users, delighting them with Software Improvements, researching new features and soliciting feedback
Contribute opinions on a range of topics, from development practices to product strategy and roadmap
Nice to haves:
Familiarity with C# and Javascript
Salary and Benefits:
You'll work 40 hours per week, Monday to Friday, in our Cambridge office, with the option of flexible home working
Salary is £32k - £35k, depending on experience and qualifications
Bupa health care
Life Insurance & Critical Illness cover
Flexible working hours
Free lunch in the office
Discounted gym membership, as well as many other wellness benefits
This role would be for a Summer 2022 start."
